{
  "title": "My Playable — 20s showcase",
  "description": "Screen-recorded playable clip with in-game audio.",
  "video_url": "https://.../final.mp4",
  "duration": 20.0,
  "width": 1080,
  "height": 1920,
  "fps": 30,
  "has_audio": true,
  "orientation": "9:16",
  "quality_tier": "ok",
  "created_at": "2026-08-14T00:00:00Z"
}
